{
  "meta": {
    "candidato": "Rafael Mendonça",
    "gerado_em": "2026-10-03T03:02:13+00:00",
    "rodada": "primeira",
    "modelo_usado": "Nenhum em tempo de execução: o motor é determinístico (engine.js). O julgamento foi feito na curadoria do corpus e no catálogo de decisões, com Claude Code.",
    "notas": "Plano gerado por cli/plano.js. Travas: 18/18. Escolhas: {\"voo\":\"VOO-D\",\"jantar_sabado\":\"livre\",\"claire\":\"cafe_curto\",\"almoco_sofia\":\"arpege\",\"lille\":\"manter\",\"jantar_terca\":\"le_duc\"}."
  },
  "decisoes": [
    {
      "id": "D-001",
      "titulo": "Qual voo emitir para Paris",
      "escolha": "Air France AF-0459 (direto, pousa 10:30 - EUR 2.610)",
      "justificativa": "Os dois caminhos se defendem e o que está em jogo é o que você disse que mais importa: estar na sessão de abertura. Não dá para decidir isso no seu lugar. Escolha vigente: Air France AF-0459. A favor: Acumula Flying Blue, e você faz questão; Único com folga real (25 min) para a sessão das 13:00; Direto: sem risco de conexão perdida; Volta 18:55 é a que já está na sua agenda. Contra: Air France está nominalmente no aviso de greve de 17 a 21/10; Se cancelar, você perde o sábado inteiro; EUR 490 mais caro que a LATAM.",
      "restricoes": [
        "R-001",
        "R-002",
        "R-010"
      ],
      "fontes": [
        "F-009",
        "F-001",
        "F-004",
        "F-033",
        "F-020"
      ],
      "metodo": "misto",
      "alternativas_descartadas": [
        {
          "opcao": "VOO-C KLM (EUR 2.450)",
          "motivo": "E Flying Blue e está fora da greve, mas pousa 11:20: com a fila de fronteira atual você chega depois das 13:00 e perde a abertura. A volta às 17:10 também não bate com a agenda."
        },
        {
          "opcao": "VOO-A TAP (EUR 1.980)",
          "motivo": "A mais barata, mas pousa em Orly às 12:40 e Orly não tem ligação direta com Villepinte. Perde a abertura com folga."
        },
        {
          "opcao": "LATAM LA-8022",
          "motivo": "Não escolhida. Contra: Não acumula Flying Blue; Pousando 10:55, a folga para a sessão das 13:00 vira zero no cenário conservador de fronteira; oneworld: sem fila prioritária na imigração"
        }
      ],
      "selecao": {
        "catalogo": "voos",
        "id": "VOO-D"
      }
    },
    {
      "id": "D-002",
      "titulo": "O jantar de sábado",
      "escolha": "Noite livre (jantar leve no hotel - EUR 55)",
      "justificativa": "Esta é a pergunta que a secretaria deixou escrita em aberto na nota de 14/08 e marcou como 'Perguntar'. Ninguém respondeu. Escolha vigente: Noite livre. A favor: Você pousou de madrugada e dorme mal em voo, mesmo em executiva; Os dois jantares de trabalho que você pediu já estão no domingo e na terça; Hotel a 8 min do pavilhão: não gasta noite em trânsito. Contra: Queima uma das cinco noites em Paris.",
      "restricoes": [
        "R-003",
        "R-006"
      ],
      "fontes": [
        "F-007",
        "F-001",
        "F-031"
      ],
      "metodo": "misto",
      "alternativas_descartadas": [
        {
          "opcao": "Jantar de trabalho",
          "motivo": "Não escolhida. Contra: Clamato é ruidoso e não aceita reserva, contra o que você já disse duas vezes; Le Duc está indisponível exatamente no sábado 17 (evento privado); Seria o terceiro jantar de trabalho, e você pediu dois"
        }
      ],
      "selecao": {
        "catalogo": "restaurantes",
        "id": "RES-06"
      }
    },
    {
      "id": "D-003",
      "titulo": "Encontrar a Claire Dubois?",
      "escolha": "Café de 30 min na terça (terça 15:30, depois do Henrik)",
      "justificativa": "Relacionamento com fundos europeus e um dos seus dois focos da edição. Mas a Claire e concorrente direta no deal da Nordvest, e você vai ver o Henrik na segunda para falar de números. O risco é de informação, não de agenda. Escolha vigente: Café de 30 min na terça. A favor: Atende seu foco declarado de relacionamento com fundos; Ela está no evento a semana toda; não aparecer também comunica algo; 30 min, sem pauta: não é reunião de conteúdo. Contra: Ela é contraparte concorrente num deal vivo; Exige disciplina: Nordvest fora da conversa.",
      "restricoes": [
        "R-007"
      ],
      "fontes": [
        "F-005",
        "F-007"
      ],
      "metodo": "misto",
      "alternativas_descartadas": [
        {
          "opcao": "Não encontrar nesta edição",
          "motivo": "Não escolhida. Contra: Perde contato com um fundo francês relevante; Pode ser lido como recuo"
        }
      ]
    },
    {
      "id": "D-004",
      "titulo": "Onde almoçar com a Sofia Marchetti",
      "escolha": "L'Arpège, 7e (cozinha vegetal - EUR ~420 para dois)",
      "justificativa": "A Sofia é vegetariana e isso já quase deu problema no jantar de Milão. O único lugar de cozinha vegetal da seleção está no 7e, e isso custa uma hora e meia de carro no seu domingo. Escolha vigente: L'Arpège, 7e. A favor: Cozinha vegetal: a anfitriã come bem, sem adaptação; Ambiente silencioso, dá para conversar; Você já fica em Paris para o jantar do time a noite. Contra: 45 min de carro em cada sentido; EUR ~420 para dois pressiona o 'bom senso' da política; No mundo real a casa fecha no domingo (ver divergência V-003).",
      "restricoes": [
        "R-004",
        "R-011"
      ],
      "fontes": [
        "F-005",
        "F-031",
        "F-004"
      ],
      "metodo": "misto",
      "alternativas_descartadas": [
        {
          "opcao": "Perto da feira",
          "motivo": "Não escolhida. Contra: Cardápio curto de hotel, fraco para uma convidada vegetariana; Repete o erro de Milão; Lugar sem graça para uma sócia que confirmou almoço com você"
        }
      ],
      "selecao": {
        "catalogo": "restaurantes",
        "id": "RES-04"
      }
    },
    {
      "id": "D-005",
      "titulo": "A visita à planta em Lille",
      "escolha": "Manter a ida a Lille (TGV 2a classe - EUR ~120)",
      "justificativa": "A visita dura 1h30 e custa cerca de 6h de porta a porta. E o único item da semana que tira você da feira por um dia inteiro. Se a planta é o ponto da viagem, vale; se e cortesia, não. Escolha vigente: Manter a ida a Lille. A favor: Ver a planta é algo que não se faz por vídeo; Está na agenda como compromisso firme; TGV é confortável: dá para trabalhar nos 62 min de cada trecho. Contra: Consome das 11:50 às 19:10, para 1h30 de visita; Tira você da feira na segunda, que é o dia em que o Henrik também está; Endereço da planta não está no corpus: o último trecho é estimado.",
      "restricoes": [
        "R-008"
      ],
      "fontes": [
        "F-002",
        "F-007",
        "F-018"
      ],
      "metodo": "misto",
      "alternativas_descartadas": [
        {
          "opcao": "Converter em call",
          "motivo": "Não escolhida. Contra: Visita de planta por vídeo não mostra o que você iria ver; Pode soar como desinteresse com a cooperativa; Compromisso já aceito: remarcar custa capital de relacionamento"
        }
      ]
    },
    {
      "id": "D-006",
      "titulo": "Onde jantar com os investidores",
      "escolha": "Le Duc, 14e (peixe, ambiente reservado - EUR ~440)",
      "justificativa": "Os dois servem. A diferença e o tamanho da mesa, e ninguém registrou quantos investidores são. Escolha vigente: Le Duc, 14e. A favor: Peixe e frutos do mar, que é o que você procura; Ambiente reservado: da para negociar e ouvir; Comporta mesa maior se forem mais de quatro. Contra: Mesmo lugar do jantar de domingo com o time; 55 min de carro desde o pavilhão.",
      "restricoes": [
        "R-006",
        "R-012"
      ],
      "fontes": [
        "F-002",
        "F-001",
        "F-031"
      ],
      "metodo": "misto",
      "alternativas_descartadas": [
        {
          "opcao": "Le Baratin, 20e",
          "motivo": "Não escolhida. Contra: Pequeno demais se a mesa passar de quatro; Não tem peixe como base do cardápio; Fecha domingo e segunda: sem margem para remarcar"
        }
      ],
      "selecao": {
        "catalogo": "restaurantes",
        "id": "RES-01"
      }
    },
    {
      "id": "D-010",
      "titulo": "Hotel: Novotel Suites Paris CDG Airport Villepinte",
      "escolha": "HOT-02",
      "justificativa": "E a única opção que fecha as três condições ao mesmo tempo: cabe no teto de EUR 320 da política, tem academia, e fica a 8 min do pavilhão. A proximidade não é conforto: e o que viabiliza chegar na sessão de abertura no sábado e não gastar noite em trânsito.",
      "restricoes": [
        "R-005",
        "R-009"
      ],
      "fontes": [
        "F-030",
        "F-004",
        "F-001",
        "F-013"
      ],
      "metodo": "regra",
      "alternativas_descartadas": [
        {
          "opcao": "HOT-05 Sofitel Le Scribe (EUR 415)",
          "motivo": "Estoura o teto de EUR 320 e a aprovação exige o comitê, que não se reúne durante a viagem. Além disso, de Opera ao pavilhão são 45-60 min: no sábado você perderia a abertura."
        },
        {
          "opcao": "HOT-03 Hyatt Place CDG (EUR 268)",
          "motivo": "Cabe no teto e tem academia, mas fica em Roissy, entre o aeroporto e o pavilhão: mais longe e EUR 63 mais caro por noite que o Novotel, sem ganho."
        },
        {
          "opcao": "HOT-01 Best Western Acadie (EUR 179)",
          "motivo": "EUR 26 mais barato e também em Villepinte, mas não tem academia, que é item que você procura."
        },
        {
          "opcao": "HOT-04 ibis Avenue d'Italie (EUR 152)",
          "motivo": "O mais barato, mas fica no extremo sul de Paris, sem academia, e a uma hora do pavilhão. Inviabiliza a semana."
        }
      ],
      "selecao": {
        "catalogo": "hoteis",
        "id": "HOT-02"
      }
    },
    {
      "id": "D-011",
      "titulo": "Quatro noites, de sábado a quarta",
      "escolha": "4 noites (17 a 21/10)",